{"algorithm":"Ed25519","keyId":"waeb-fixture-test-key-1","publicKeyFingerprint":"sha256:17f1694d3f0457248236d70a2346d7eece8862bab742a05d60d0dc1d9dc87591","publicKeyFormat":"DER-SPKI","publicKeySpkiBase64":"MCowBQYDK2VwAyEAxrnOezvT1J12ue+NN/83nnWfdisLaBnlQ94KsVp7SBc=","schemaVersion":"1.0.0","synthetic":true}
